Title,Authors,Publication Date,DOI,Source
An Exploratory Review of Malaysian E-Commerce Merchants and Their Readiness in Adopting Business Analytics Models for Assessment of Business KPIs,Teh Z.H.,2021-01-01,10.1109/RTSI50628.2021.9597241,"6th International Forum on Research and Technology for Society and Industry, RTSI 2021 - Proceedings"
A triad-based contextualisation approach for better critical issues' decision making support,Lim C.,2016-01-01,N/A,ARPN Journal of Engineering and Applied Sciences
A triad-based contextualisation approach for understanding of a critical issue in a government investment agency,Lim C.,2016-01-01,10.1541/ieejeiss.136.1753,"IEEJ Transactions on Electronics, Information and Systems"
Verification mechanism for online responses in criteria prioritization,Lim C.,2013-02-11,10.4028/www.scientific.net/AMM.275-277.2555,Applied Mechanics and Materials
A methodology for deliberating prediction criteria,Lim C.Y.,2012-01-01,10.4028/www.scientific.net/AMM.130-134.1758,Applied Mechanics and Materials
Customer relationship management: Computer-assisted tools for customer lifetime value prediction,Yean L.C.,2010-11-08,10.1109/ITSIM.2010.5561487,"Proceedings 2010 International Symposium on Information Technology - System Development and Application and Knowledge Society, ITSim'10"
Customer relationship management: Lifecycle of predicting customer lifetime value,Yean L.C.,2010-08-09,10.1109/ICCRD.2010.24,"2nd International Conference on Computer Research and Development, ICCRD 2010"
