Title,Authors,Publication Date,DOI,Source
The Influence of the Barriers of Hybrid Strategy on Strategic Competitive Priorities: Evidence from Oil Companies,Alnoor A.,2023-06-01,10.1007/s40171-022-00335-8,Global Journal of Flexible Systems Management
"Correction to: Circular economy of medical waste: novel intelligent medical waste management framework based on extension linear Diophantine fuzzy FDOSM and neural network approach (Environmental Science and Pollution Research, (2023), 30, 21, (60473-60499), 10.1007/s11356-023-26677-z)",Chew X.Y.,2023-05-01,10.1007/s11356-023-27165-0,Environmental Science and Pollution Research
Circular economy of medical waste: novel intelligent medical waste management framework based on extension linear Diophantine fuzzy FDOSM and neural network approach,Chew X.Y.,2023-05-01,10.1007/s11356-023-26677-z,Environmental Science and Pollution Research
Spurring sustainability commitment strategy of family-owned SMEs: A multi-analytical SEM &amp; ANFIS perspective,Khaw K.W.,2023-05-01,10.1016/j.hitech.2023.100453,Journal of High Technology Management Research
INFLUENCE OF ORGANIZATIONAL CONTINGENCIES ON FINANCIAL PERFORMANCE: MEDIATING ROLE OF CRISIS MANAGEMENT,Zaidan A.S.,2023-01-01,10.18267/j.cebr.320,Central European Business Review
Real-time load forecasting model for the smart grid using bayesian optimized CNN-BiLSTM,Zhang D.,2023-01-01,10.3389/fenrg.2023.1193662,Frontiers in Energy Research
Alternative Design of One-Sided Shewhart Control Charts for the Multivariate Coefficient of Variation,Chew X.,2023-01-01,10.47836/pjst.31.1.35,Pertanika Journal of Science and Technology
Synthetic c charts with known and estimated process parameters based on median run length and expected median run length,Lee M.H.,2023-01-01,10.1080/16843703.2022.2098456,Quality Technology and Quantitative Management
Credit Card Fraud Detection Using a New Hybrid Machine Learning Architecture,Malik E.F.,2022-05-01,10.3390/math10091480,Mathematics
Uncovering the antecedents of trust in social commerce: an application of the non-linear artificial neural network approach,Alnoor A.,2022-04-21,10.1108/CR-04-2021-0051,Competitiveness Review
Design of the Shewhart Median Scheme with the Percentile-Based Approach,Chong Z.L.,2022-02-24,10.1145/3524304.3524334,ACM International Conference Proceeding Series
A proposed variable sampling interval median chart for identifying out-of-control signals in process control,Saha S.,2022-01-01,10.1109/ICCIT57492.2022.10055777,"Proceedings of 2022 25th International Conference on Computer and Information Technology, ICCIT 2022"
NEW HYBRID DATA PREPROCESSING TECHNIQUE FOR HIGHLY IMBALANCED DATASET,Malik E.F.,2022-01-01,10.31577/cai_2022_4_981,Computing and Informatics
Comparative analysis of some selected generative adversarial network models for image augmentation: A case study of COVID-19 x-ray and CT images,Ubale Kiru M.,2022-01-01,10.3233/JIFS-220017,Journal of Intelligent and Fuzzy Systems
Based on the perception of ethics in social commerce platforms: Adopting SEM and MCDM approaches for benchmarking customers in rural communities,Sadaa A.M.,2022-01-01,10.1007/s12144-022-04069-9,Current Psychology
How Positive and Negative Electronic Word of Mouth (eWOM) Affects Customers’ Intention to Use Social Commerce? A Dual-Stage Multi Group-SEM and ANN Analysis,Alnoor A.,2022-01-01,10.1080/10447318.2022.2125610,International Journal of Human-Computer Interaction
The multivariate exponentially weighted moving average chart for monitoring short production runs,Lee M.H.,2022-01-01,10.1080/03610918.2022.2108054,Communications in Statistics: Simulation and Computation
PREDICTING DETERMINANTS OF USE MOBILE COMMERCE THROUGH MODELLING NON-LINEAR RELATIONSHIPS,Abdullah H.,2022-01-01,10.18267/j.cebr.306,Central European Business Review
"Modelling and Evaluating Trust in Mobile Commerce: A Hybrid Three Stage Fuzzy Delphi, Structural Equation Modeling, and Neural Network Approach",Khaw K.W.,2022-01-01,10.1080/10447318.2021.2004700,International Journal of Human-Computer Interaction
The efficiency of run rules schemes for the multivariate coefficient of variation in short runs process,Chew X.Y.,2022-01-01,10.1080/03610918.2019.1704783,Communications in Statistics: Simulation and Computation
Design of one-sided modified s control charts for monitoring a finite horizon process,Teng M.T.,2021-09-01,10.24412/1932-2321-2021-363-168-182,Reliability: Theory and Applications
Economic and economic-statistical designs of the side sensitive group runs chart with auxiliary information,Ng P.S.,2021-07-01,10.1002/qre.2841,Quality and Reliability Engineering International
Neural architecture search for lightweight neural network in food recognition,Tan R.Z.,2021-06-01,10.3390/math9111245,Mathematics
An improved Hotelling's T<sup>2</sup> chart for monitoring a finite horizon process based on run rules schemes: A Markov-chain approach,Chew X.Y.,2021-05-01,10.1002/asmb.2596,Applied Stochastic Models in Business and Industry
The economic design of the double sampling x chart with measurement errors,Khee Yong Si K.S.,2021-03-01,10.37622/IJDE/15.2.2020.259-274,International Journal of Difference Equations
One-sided 4-out-of-5 run rules charts for the multivariate coefficient of variation in the finite horizon process,Khaw K.W.,2021-01-01,10.37394/23206.2021.20.47,WSEAS Transactions on Mathematics
Evaluation of variable parameter mcv control chart in downward process shifts,Chew X.,2021-01-01,10.37394/23203.2021.16.43,WSEAS Transactions on Systems and Control
An Optimal Adaptive Variable Sample Size Scheme for the Multivariate Coefficient of Variation,Khaw K.W.,2021-01-01,10.19139/soic-2310-5070-996,"Statistics, Optimization and Information Computing"
Economic-statistical design of the variable sampling interval Poisson EWMA chart,Lee M.H.,2021-01-01,10.1080/03610918.2021.1898637,Communications in Statistics: Simulation and Computation
Economic-statistical design of variable parameters s chart,Lee M.H.,2020-09-02,10.1080/16843703.2019.1699687,Quality Technology and Quantitative Management
The efficiency of run rules schemes for the multivariate coefficient of variation: a Markov chain approach,Chew X.,2020-02-17,10.1080/02664763.2019.1643296,Journal of Applied Statistics
Design of the synthetic multivariate coefficient of variation chart based on the median run length,Lee M.H.,2020-01-01,10.37418/amsj.9.9.86,Advances in Mathematics: Scientific Journal
Quantized Deep Residual Convolutional Neural Network for Image-Based Dietary Assessment,Tan R.Z.,2020-01-01,10.1109/ACCESS.2020.3003518,IEEE Access
One-sided downward control chart for monitoring the multivariate coefficient of variation with vssi strategy,Chew X.Y.,2020-01-01,10.5614/j.math.fund.sci.2020.52.1.8,Journal of Mathematical and Fundamental Sciences
Effect of measurement errors on the performance of coefficient of variation chart with short production runs,Lee M.H.,2020-01-01,10.1109/ACCESS.2020.2985410,IEEE Access
Economic-statistical design of synthetic np chart with estimated process parameter,Lee M.H.,2020-01-01,10.1371/journal.pone.0230994,PLoS ONE
Optimal Design of Modified Group Runs Scheme with Estimated Process Parameters Based on Expected Average Number of Observations to Signal,Chong Z.L.,2019-12-01,10.1109/IEEM44572.2019.8978495,IEEE International Conference on Industrial Engineering and Engineering Management
A proposed variable parameter control chart for monitoring the multivariate coefficient of variation,Chew X.,2019-11-01,10.1002/qre.2536,Quality and Reliability Engineering International
The effect of measurement errors on the double sampling X chart,Lee M.H.,2019-09-01,N/A,Compusoft
The coefficient of variation chart based on median run length,Lee M.,2019-09-01,10.35940/ijeat.F1035.0986S319,International Journal of Engineering and Advanced Technology
Optimal design of the synthetic control chart for monitoring the multivariate coefficient of variation,Khaw K.,2019-03-15,10.1016/j.chemolab.2019.02.001,Chemometrics and Intelligent Laboratory Systems
Optimal variable sample size and sampling interval control chart for the process mean based on expected average time to signal,Khaw K.W.,2019-01-01,10.18178/ijmlc.2019.9.6.887,International Journal of Machine Learning and Computing
A re-evaluation of the run rules control charts for monitoring the coefficient of variation,Khaw K.W.,2019-01-01,10.19139/soic-2310-5070-717,"Statistics, Optimization and Information Computing"
Timing-of-delivery prediction model to visualize delivery trends for pos laju malaysia by machine learning techniques,Quah J.W.,2019-01-01,10.1007/978-981-13-3441-2_7,Communications in Computer and Information Science
A comparison of the variable sampling interval (VSI) and variable sample size (VSS) coefficient of variation charts,Lim S.L.,2018-01-01,10.11159/icmie18.129,"Proceedings of the World Congress on Mechanical, Chemical, and Material Engineering"
The Run Sum Hotelling's χ<sup>2</sup> Control Chart with Variable Sampling Intervals,Chew X.,2016-11-01,10.1002/qre.1960,Quality and Reliability Engineering International
The variable sampling interval run sum X control chart,Chew X.,2015-12-15,10.1016/j.cie.2015.08.015,Computers and Industrial Engineering
